Title,Media URL,Pinterest board,Thumbnail,Description,Link,Publish date,Keywords,Pin URL
"Looking ahead to 2025? This pin explores fresh, innovative Instagram feed ideas to keep your content captivating and ahead of the curve. Discover trending aesthetics, engaging formats, and strategic posting techniques to maximize your reach and grow your audience. From bold visuals to interactive stories, find inspiration to elevate your Instagram presence in the new year and beyond. Get ahead of the game – plan your 2025 Instagram feed now. Feed Post Ideas, Template Instagram Post, Instagram Feed Ideas Business, Social Media Feed Design, Shop Banner Design Ideas, Nike Instagram Feed, Event Instagram Feed, Brand Instagram Feed Ideas, Post Instagram Design ✨493",https://i.pinimg.com/236x/df/15/32/df153244956464836801459c2b596dfc.jpg,Modern Canva Templates for Entrepreneurs,,"18 nov 2024 - Instagram is a huge social network with over 1 million activeusers – a user base that is continuing to grow even now with no signs of slowing down. It is quick to manage thanks to its largely visual nature, and has some of the best engagement on the web.Many companies use Instagram to boost their products and services …",https://sites.google.com/view/socialglowstudio/?q=Looking+ahead+to+2025%3F+This+pin+explores+fresh%2C+innovative+Instagram+feed+ideas+to+keep+your+content+captivating+and+ahead+of+the+curve.+Discover+trending+aesthetics%2C+engaging+formats%2C+and+strategic+posting+techniques+to+maximize+your+reach+and+grow+your+audience.+From+bold+visuals+to+interactive+stories%2C+find+inspiration+to+elevate+your+Instagram+presence+in+the+new+year+and+beyond.+Get+ahead+of+the+game+%E2%80%93+plan+your+2025+Instagram+feed+now.+Feed+Post+Ideas%2C+Template+Instagram+Post%2C+Instagram+Feed+Ideas+Business%2C+Social+Media+Feed+Design%2C+Shop+Banner+Design+Ideas%2C+Nike+Instagram+Feed%2C+Event+Instagram+Feed%2C+Brand+Instagram+Feed+Ideas%2C+Post+Instagram+Design+%E2%9C%A8493,2026-01-26 21:03:00,"social media design graphics,social media design inspiration,social media designs,social media design ideas,social media design graphics posts,social media design post,social media design ads,social media design background,social media design template,social media design graphics marketing",https://www.pinterest.com/pin/114208540547361830/
a white poster with the words'70 killer content ideas to post on social media ✨903,https://i.pinimg.com/236x/cd/60/72/cd6072bf41e418d8447b305354723e18.jpg,Modern Canva Templates for Entrepreneurs,,"Mar 7, 2025 - My name is Alena. I am an artist. The main theme of my work is female beauty.",https://sites.google.com/view/socialglowstudio/?q=a+white+poster+with+the+words%2770+killer+content+ideas+to+post+on+social+media+%E2%9C%A8903,2026-01-26 22:44:00,"social media design graphics,social media design inspiration,social media designs,social media design ideas,social media design graphics posts,social media design post,social media design ads,social media design background,social media design template,social media design graphics marketing",https://www.pinterest.com/pin/1025061565190098094/
a white poster with the words how to create a killer social media marketing strategy on it ✨356,https://i.pinimg.com/236x/7a/87/44/7a8744f456a1ee85375030293dec8cf2.jpg,Modern Canva Templates for Entrepreneurs,,"Jan 7, 2025 - Discover how to grow your business with a proven social media marketing strategy that drives real results and improves online sales.",https://sites.google.com/view/socialglowstudio/?q=a+white+poster+with+the+words+how+to+create+a+killer+social+media+marketing+strategy+on+it+%E2%9C%A8356,2026-01-27 00:14:00,"social media design graphics,social media design inspiration,social media designs,social media design ideas,social media design graphics posts,social media design post,social media design ads,social media design background,social media design template,social media design graphics marketing",https://www.pinterest.com/pin/9359111722002078/
an image of the back cover of a magazine or brochure with yellow and black colors ✨231,https://i.pinimg.com/236x/c1/a9/37/c1a9373e734b0d6d7846a249bd5c8b78.jpg,Modern Canva Templates for Entrepreneurs,,"Fiverr freelancer will provide Web Banners services and design web banner kit, ads, hero image, header, and slider including Source file within 1 day",https://sites.google.com/view/socialglowstudio/?q=an+image+of+the+back+cover+of+a+magazine+or+brochure+with+yellow+and+black+colors+%E2%9C%A8231,2026-01-27 02:06:00,"social media design graphics,social media design inspiration,social media designs,social media design ideas,social media design graphics posts,social media design post,social media design ads,social media design background,social media design template,social media design graphics marketing",https://www.pinterest.com/pin/4574037116648540/
"the collage is made up of many different images and words on it, including one woman's face ✨410",https://i.pinimg.com/236x/c2/3c/e9/c23ce9846c6f1e63a9fe5fee092d45ac.jpg,Modern Canva Templates for Entrepreneurs,,"Aug 26, 2025 - This Pin was discovered by anne.. Discover (and save!) your own Pins on Pinterest",https://sites.google.com/view/socialglowstudio/?q=the+collage+is+made+up+of+many+different+images+and+words+on+it%2C+including+one+woman%27s+face+%E2%9C%A8410,2026-01-27 03:46:00,"social media design graphics,social media design inspiration,social media designs,social media design ideas,social media design graphics posts,social media design post,social media design ads,social media design background,social media design template,social media design graphics marketing",https://www.pinterest.com/pin/7177680652337182/
Designing Social Impact: Kamila Machado's Innovative Studio ✨238,https://i.pinimg.com/236x/f9/0c/6f/f90c6f7a06e53cb33ee7b8afadbe7b01.jpg,Modern Canva Templates for Entrepreneurs,,Get instant access to your social media calendar and boost your marketing. Plan your social media content with a calendar and skyrocket your business.,https://sites.google.com/view/socialglowstudio/?q=Designing+Social+Impact%3A+Kamila+Machado%27s+Innovative+Studio+%E2%9C%A8238,2026-01-27 05:40:00,"social media design graphics,social media design inspiration,social media designs,social media design ideas,social media design graphics posts,social media design post,social media design ads,social media design background,social media design template,social media design graphics marketing",https://www.pinterest.com/pin/49750770880062638/
the back cover of an electronic device with various images and text on it's side ✨109,https://i.pinimg.com/236x/f1/73/ae/f173aebecd9b897c810ce01f5b8a4425.jpg,Modern Canva Templates for Entrepreneurs,,"80 INSTAGRAM POST & STORY TEMPLATES 100% EDITABLE and CUSTOMIZABLE CANVA Templates for Instagram, Facebook, LinkedIn or any other social media platform. Perfect",https://sites.google.com/view/socialglowstudio/?q=the+back+cover+of+an+electronic+device+with+various+images+and+text+on+it%27s+side+%E2%9C%A8109,2026-01-27 07:18:00,"social media design graphics,social media design inspiration,social media designs,social media design ideas,social media design graphics posts,social media design post,social media design ads,social media design background,social media design template,social media design graphics marketing",https://www.pinterest.com/pin/1029776271027558641/
a flyer for a burger restaurant ✨715,https://i.pinimg.com/236x/ed/64/76/ed6476a03d12c57126df49505713514d.jpg,Modern Canva Templates for Entrepreneurs,,Download this premium PSD file for a fast food social media post template. Explore more high-quality graphic design resources on Freepik.,https://sites.google.com/view/socialglowstudio/?q=a+flyer+for+a+burger+restaurant+%E2%9C%A8715,2026-01-27 08:58:00,"social media design graphics,social media design inspiration,social media designs,social media design ideas,social media design graphics posts,social media design post,social media design ads,social media design background,social media design template,social media design graphics marketing",https://www.pinterest.com/pin/1548181153145325/
"Nutrition Marketing Ideas, Wellness Advertising, Creative Social Media Ideas, Social Media Post Business, Interactive Social Media, Creative Design Social Media, Wellness Post Ideas, Nutrition Creativ ✨288",https://i.pinimg.com/236x/96/c9/73/96c973cd954fff81c2fa918b743a4dad.jpg,Modern Canva Templates for Entrepreneurs,,This Pin was discovered by Social Media Design by Prof.. Discover (and save!) your own Pins on Pinterest,https://sites.google.com/view/socialglowstudio/?q=Nutrition+Marketing+Ideas%2C+Wellness+Advertising%2C+Creative+Social+Media+Ideas%2C+Social+Media+Post+Business%2C+Interactive+Social+Media%2C+Creative+Design+Social+Media%2C+Wellness+Post+Ideas%2C+Nutrition+Creativ+%E2%9C%A8288,2026-01-27 10:56:00,"social media design graphics,social media design inspiration,social media designs,social media design ideas,social media design graphics posts,social media design post,social media design ads,social media design background,social media design template,social media design graphics marketing",https://www.pinterest.com/pin/30680841208534266/
a red and white flyer with a man on a laptop ✨465,https://i.pinimg.com/236x/41/03/69/410369e27a28da5f48b9644d90e5f133.jpg,Modern Canva Templates for Entrepreneurs,,Download this Premium PSD of Psd grow business faster corporate social media banner design or instagram post template and explore millions of professional PSD files on Freepik.,https://sites.google.com/view/socialglowstudio/?q=a+red+and+white+flyer+with+a+man+on+a+laptop+%E2%9C%A8465,2026-01-27 12:29:00,"social media design graphics,social media design inspiration,social media designs,social media design ideas,social media design graphics posts,social media design post,social media design ads,social media design background,social media design template,social media design graphics marketing",https://www.pinterest.com/pin/3166662231282152/
"an iphone screen with various images and text on it, including the words'happy artisan ✨259",https://i.pinimg.com/236x/d8/c9/ca/d8c9ca462c6fcf619c05bb7e1bcc7739.jpg,Modern Canva Templates for Entrepreneurs,,31 de mar de 2025 - Smau_l encontrou este Pin. Encontre (e salve!) seus próprios Pins no Pinterest.,https://sites.google.com/view/socialglowstudio/?q=an+iphone+screen+with+various+images+and+text+on+it%2C+including+the+words%27happy+artisan+%E2%9C%A8259,2026-01-27 14:02:00,"social media design graphics,social media design inspiration,social media designs,social media design ideas,social media design graphics posts,social media design post,social media design ads,social media design background,social media design template,social media design graphics marketing",https://www.pinterest.com/pin/1829656094399027/
"an iphone screen with various images and text on the bottom right corner, below which reads best media ae ✨578",https://i.pinimg.com/236x/7d/59/ac/7d59ac7e3af97b3e856c904d396ff6d9.jpg,Modern Canva Templates for Entrepreneurs,,"Jul 2, 2025 - Graphic Design, Interaction Design, Product Design, Canva, WordPress, WordPress theme",https://sites.google.com/view/socialglowstudio/?q=an+iphone+screen+with+various+images+and+text+on+the+bottom+right+corner%2C+below+which+reads+best+media+ae+%E2%9C%A8578,2026-01-27 15:50:00,"social media design graphics,social media design inspiration,social media designs,social media design ideas,social media design graphics posts,social media design post,social media design ads,social media design background,social media design template,social media design graphics marketing",https://www.pinterest.com/pin/1829656094816097/
"several different types of business brochures are shown in this collage, including one with ✨335",https://i.pinimg.com/236x/e3/2f/ce/e32fce93024f3aae926e7b41f007cc56.jpg,Modern Canva Templates for Entrepreneurs,,"Jul 5, 2025 - Graphic Design, Illustration, Adobe Photoshop",https://sites.google.com/view/socialglowstudio/?q=several+different+types+of+business+brochures+are+shown+in+this+collage%2C+including+one+with+%E2%9C%A8335,2026-01-27 17:49:00,"social media design graphics,social media design inspiration,social media designs,social media design ideas,social media design graphics posts,social media design post,social media design ads,social media design background,social media design template,social media design graphics marketing",https://www.pinterest.com/pin/6403624465749553/
"Astrus Studio, especializado em mídias digitais. Trabalhamos no desenvolvimento de publicações para redes sociais, criação de identidades corporativas e edição de vídeo em motion design. Todos os projetos são executados com uma estratégia direcionada ao público-alvo de cada cliente, com foco na conversão de potenciais novos clientes! ✨989",https://i.pinimg.com/236x/ae/eb/74/aeeb74d7e1a7901f1445aaf5029728ea.jpg,Modern Canva Templates for Entrepreneurs,,"✦ Projeto estratégico para mídias digitais. Naming, Identidade Visual e Social Media.",https://sites.google.com/view/socialglowstudio/?q=Astrus+Studio%2C+especializado+em+m%C3%ADdias+digitais.+Trabalhamos+no+desenvolvimento+de+publica%C3%A7%C3%B5es+para+redes+sociais%2C+cria%C3%A7%C3%A3o+de+identidades+corporativas+e+edi%C3%A7%C3%A3o+de+v%C3%ADdeo+em+motion+design.+Todos+os+projetos+s%C3%A3o+executados+com+uma+estrat%C3%A9gia+direcionada+ao+p%C3%BAblico-alvo+de+cada+cliente%2C+com+foco+na+convers%C3%A3o+de+potenciais+novos+clientes%21+%E2%9C%A8989,2026-01-27 19:20:00,"social media design graphics,social media design inspiration,social media designs,social media design ideas,social media design graphics posts,social media design post,social media design ads,social media design background,social media design template,social media design graphics marketing",https://www.pinterest.com/pin/985231163311970/
an iphone screen showing the user's profile and other things to see on it ✨322,https://i.pinimg.com/236x/1d/07/d5/1d07d579ccf29ae15e41ae514cd9d162.jpg,Modern Canva Templates for Entrepreneurs,,"Aug 23, 2025 - This Pin was discovered by Social Media Design. Discover (and save!) your own Pins on Pinterest",https://sites.google.com/view/socialglowstudio/?q=an+iphone+screen+showing+the+user%27s+profile+and+other+things+to+see+on+it+%E2%9C%A8322,2026-01-27 20:50:00,"social media design graphics,social media design inspiration,social media designs,social media design ideas,social media design graphics posts,social media design post,social media design ads,social media design background,social media design template,social media design graphics marketing",https://www.pinterest.com/pin/4714774605211050/
an advertisement for ear piercings with the words in spanish and english on pink background ✨471,https://i.pinimg.com/236x/93/8b/1c/938b1cefdb23a44b24fe0fa5014b1933.jpg,Modern Canva Templates for Entrepreneurs,,"20 de fev de 2025 - Trendy Treasure for Social Media Success! Discover stylish and easy-to-use Instagram templates for every content type. Create a unique feed, captivate your audience, and save precious time. Your go-to",https://sites.google.com/view/socialglowstudio/?q=an+advertisement+for+ear+piercings+with+the+words+in+spanish+and+english+on+pink+background+%E2%9C%A8471,2026-01-27 22:47:00,"social media design graphics,social media design inspiration,social media designs,social media design ideas,social media design graphics posts,social media design post,social media design ads,social media design background,social media design template,social media design graphics marketing",https://www.pinterest.com/pin/295126581853658171/
the website is designed to look like it could be used for advertising and other purposes ✨863,https://i.pinimg.com/236x/e5/0f/f8/e50ff8b48f5fae2090b88002f39a2946.jpg,Modern Canva Templates for Entrepreneurs,,Angela encontrou este Pin. Encontre (e salve!) seus próprios Pins no Pinterest.,https://sites.google.com/view/socialglowstudio/?q=the+website+is+designed+to+look+like+it+could+be+used+for+advertising+and+other+purposes+%E2%9C%A8863,2026-01-28 00:27:00,"social media design graphics,social media design inspiration,social media designs,social media design ideas,social media design graphics posts,social media design post,social media design ads,social media design background,social media design template,social media design graphics marketing",https://www.pinterest.com/pin/281543724361171/
a woman is smiling while looking at her cell phone in front of a green background ✨570,https://i.pinimg.com/236x/f4/c4/8b/f4c48be4b55d21037adcf4e5531a4675.jpg,Modern Canva Templates for Entrepreneurs,,This Pin was discovered by Fer Arza Sacco. Discover (and save!) your own Pins on Pinterest,https://sites.google.com/view/socialglowstudio/?q=a+woman+is+smiling+while+looking+at+her+cell+phone+in+front+of+a+green+background+%E2%9C%A8570,2026-01-28 02:06:00,"social media design graphics,social media design inspiration,social media designs,social media design ideas,social media design graphics posts,social media design post,social media design ads,social media design background,social media design template,social media design graphics marketing",https://www.pinterest.com/pin/70437489133727/
a man wearing a hard hat and green safety gear with the words abril verde ✨325,https://i.pinimg.com/236x/a4/6f/70/a46f704928414c5be1def4d53a3c5967.jpg,Modern Canva Templates for Entrepreneurs,,This Pin was discovered by Social Media Design by Prof.. Discover (and save!) your own Pins on Pinterest,https://sites.google.com/view/socialglowstudio/?q=a+man+wearing+a+hard+hat+and+green+safety+gear+with+the+words+abril+verde+%E2%9C%A8325,2026-01-28 03:57:00,"social media design graphics,social media design inspiration,social media designs,social media design ideas,social media design graphics posts,social media design post,social media design ads,social media design background,social media design template,social media design graphics marketing",https://www.pinterest.com/pin/545498573637178656/
someone is holding up their cell phone with the text customer testimonal on it ✨715,https://i.pinimg.com/236x/27/07/39/2707392ea5603101ea637cdd8d593263.jpg,Modern Canva Templates for Entrepreneurs,,"Mar 28, 2025 - This Pin was discovered by Social Media Aesthetic Graphic. Discover (and save!) your own Pins on Pinterest",https://sites.google.com/view/socialglowstudio/?q=someone+is+holding+up+their+cell+phone+with+the+text+customer+testimonal+on+it+%E2%9C%A8715,2026-01-28 05:39:00,"social media design graphics,social media design inspiration,social media designs,social media design ideas,social media design graphics posts,social media design post,social media design ads,social media design background,social media design template,social media design graphics marketing",https://www.pinterest.com/pin/35817759533236050/
"an assortment of business cards with different font and colors, including blue, red, green, ✨867",https://i.pinimg.com/236x/ab/99/82/ab99827a9be7e5e60c5e3ca5303059f4.jpg,Modern Canva Templates for Entrepreneurs,,"Nov 3, 2025 - Make your Instagram presence stand out with this stunning bold Canva template! Perfect for engaging multiple slides, it’s easy to customize and helps communicate your message effectively. 📸✨ Use this template to increase engagement and make your posts memorable. Limited slots available — grab yours now and start designing like a pro! 🚀",https://sites.google.com/view/socialglowstudio/?q=an+assortment+of+business+cards+with+different+font+and+colors%2C+including+blue%2C+red%2C+green%2C+%E2%9C%A8867,2026-01-28 07:38:00,"social media design graphics,social media design inspiration,social media designs,social media design ideas,social media design graphics posts,social media design post,social media design ads,social media design background,social media design template,social media design graphics marketing",https://www.pinterest.com/pin/941533865901436814/
a series of photos showing different types of people in the process of creating an advertisement ✨474,https://i.pinimg.com/236x/2c/76/3c/2c763ce477e1513c01a459b0a9b88c1c.jpg,Modern Canva Templates for Entrepreneurs,,This Pin was discovered by Style Spectrum. Discover (and save!) your own Pins on Pinterest,https://sites.google.com/view/socialglowstudio/?q=a+series+of+photos+showing+different+types+of+people+in+the+process+of+creating+an+advertisement+%E2%9C%A8474,2026-01-28 09:08:00,"social media design graphics,social media design inspiration,social media designs,social media design ideas,social media design graphics posts,social media design post,social media design ads,social media design background,social media design template,social media design graphics marketing",https://www.pinterest.com/pin/113786328083566000/
"a collage of images with different colors and font on the same page, including an image ✨432",https://i.pinimg.com/236x/59/5d/e2/595de2ed320ae31d18d846d2d5340346.jpg,Modern Canva Templates for Entrepreneurs,,Social Media 2018 on Behance Source by luisafermc,https://sites.google.com/view/socialglowstudio/?q=a+collage+of+images+with+different+colors+and+font+on+the+same+page%2C+including+an+image+%E2%9C%A8432,2026-01-28 10:46:00,"social media design graphics,social media design inspiration,social media designs,social media design ideas,social media design graphics posts,social media design post,social media design ads,social media design background,social media design template,social media design graphics marketing",https://www.pinterest.com/pin/22236591905109519/
#Social_Media_Marketing_Portfolio #Social_Media_Manager_Quotes #Community_Manager_Aesthetic #Social_Media_Marketing_Aesthetic ✨858,https://i.pinimg.com/236x/e9/55/22/e95522bfb4a9260944f1d102e44bdb59.jpg,Modern Canva Templates for Entrepreneurs,,"Social Media Manager Template, Nude and Beige Digital Aesthetic #instastoryideas #igstoryideas #instagramstorytemplate #instagramstory",https://sites.google.com/view/socialglowstudio/?q=%23Social_Media_Marketing_Portfolio+%23Social_Media_Manager_Quotes+%23Community_Manager_Aesthetic+%23Social_Media_Marketing_Aesthetic+%E2%9C%A8858,2026-01-28 12:30:00,"social media design graphics,social media design inspiration,social media designs,social media design ideas,social media design graphics posts,social media design post,social media design ads,social media design background,social media design template,social media design graphics marketing",https://www.pinterest.com/pin/769834130098830960/
"Join thousands of small businesses leveraging over 2.5 million free Instagram templates 🎯. Perfect for marketing graphics, engagement strategies, and social media games. Make your brand visually appealing and grow your followers with eye-catching designs. Don't miss out—level up your social media game today! 📈🚀 Marketing Graphics, Engagement Strategies, Social Media Games, Business Mentor, Free Instagram, Instagram Marketing, Instagram Template, Social Media Template, Social Media Post ✨607",https://i.pinimg.com/236x/81/e1/a3/81e1a329c3cbb61564b38826507ccac6.jpg,Modern Canva Templates for Entrepreneurs,,"Nov 4, 2025 - Grow your brand effortlessly with over 2.5 million eye-catching social media templates 🎨. Perfect for Instagram marketing, engagement, and strategy, these free designs are ideal for small businesses and social media games. Get your business mentor’s edge today—stay ahead with sleek, ready-to-use graphics that captivate your audience and drive results! 🚀",https://sites.google.com/view/socialglowstudio/?q=Join+thousands+of+small+businesses+leveraging+over+2.5+million+free+Instagram+templates+%F0%9F%8E%AF.+Perfect+for+marketing+graphics%2C+engagement+strategies%2C+and+social+media+games.+Make+your+brand+visually+appealing+and+grow+your+followers+with+eye-catching+designs.+Don%27t+miss+out%E2%80%94level+up+your+social+media+game+today%21+%F0%9F%93%88%F0%9F%9A%80+Marketing+Graphics%2C+Engagement+Strategies%2C+Social+Media+Games%2C+Business+Mentor%2C+Free+Instagram%2C+Instagram+Marketing%2C+Instagram+Template%2C+Social+Media+Template%2C+Social+Media+Post+%E2%9C%A8607,2026-01-28 14:18:00,"social media design graphics,social media design inspiration,social media designs,social media design ideas,social media design graphics posts,social media design post,social media design ads,social media design background,social media design template,social media design graphics marketing",https://www.pinterest.com/pin/909656824757888263/
"brochures designed to promote local businesses in latin america, including local health services ✨951",https://i.pinimg.com/236x/45/83/37/4583373ff9de06c1253c47283b65674f.jpg,Modern Canva Templates for Entrepreneurs,,"Welcome to CreativeCanvaTemplates — your one-stop hub for stylish and free Canva templates! Whether you're looking to boost your Instagram game, create beautiful banners, or explore aesthetic post ideas, we've got everything you need. Let's make your social media shine!",https://sites.google.com/view/socialglowstudio/?q=brochures+designed+to+promote+local+businesses+in+latin+america%2C+including+local+health+services+%E2%9C%A8951,2026-01-28 16:16:00,"social media design graphics,social media design inspiration,social media designs,social media design ideas,social media design graphics posts,social media design post,social media design ads,social media design background,social media design template,social media design graphics marketing",https://www.pinterest.com/pin/140806232536485/
