Title,Media URL,Pinterest board,Thumbnail,Description,Link,Publish date,Keywords,Pin URL
"Join thousands of small businesses leveraging over 2.5 million free Instagram templates 🎯. Perfect for marketing graphics, engagement strategies, and social media games. Make your brand visually appealing and grow your followers with eye-catching designs. Don't miss out—level up your social media game today! 📈🚀 Marketing Graphics, Engagement Strategies, Social Media Games, Business Mentor, Free Instagram, Instagram Marketing, Instagram Template, Social Media Template, Social Media Post ✨376",https://i.pinimg.com/236x/81/e1/a3/81e1a329c3cbb61564b38826507ccac6.jpg,Modern Canva Templates for Entrepreneurs,,"Nov 4, 2025 - Grow your brand effortlessly with over 2.5 million eye-catching social media templates 🎨. Perfect for Instagram marketing, engagement, and strategy, these free designs are ideal for small businesses and social media games. Get your business mentor’s edge today—stay ahead with sleek, ready-to-use graphics that captivate your audience and drive results! 🚀",https://sites.google.com/view/socialglowstudio/?q=Join+thousands+of+small+businesses+leveraging+over+2.5+million+free+Instagram+templates+%F0%9F%8E%AF.+Perfect+for+marketing+graphics%2C+engagement+strategies%2C+and+social+media+games.+Make+your+brand+visually+appealing+and+grow+your+followers+with+eye-catching+designs.+Don%27t+miss+out%E2%80%94level+up+your+social+media+game+today%21+%F0%9F%93%88%F0%9F%9A%80+Marketing+Graphics%2C+Engagement+Strategies%2C+Social+Media+Games%2C+Business+Mentor%2C+Free+Instagram%2C+Instagram+Marketing%2C+Instagram+Template%2C+Social+Media+Template%2C+Social+Media+Post+%E2%9C%A8376,2026-01-21 13:43:00,"social media design graphics,social media design inspiration,social media designs,social media design ideas,social media design graphics posts,social media design post,social media design ads,social media design background,social media design template,social media design graphics marketing",https://www.pinterest.com/pin/909656824757888263/
"brochures designed to promote local businesses in latin america, including local health services ✨627",https://i.pinimg.com/236x/45/83/37/4583373ff9de06c1253c47283b65674f.jpg,Modern Canva Templates for Entrepreneurs,,"Welcome to CreativeCanvaTemplates — your one-stop hub for stylish and free Canva templates! Whether you're looking to boost your Instagram game, create beautiful banners, or explore aesthetic post ideas, we've got everything you need. Let's make your social media shine!",https://sites.google.com/view/socialglowstudio/?q=brochures+designed+to+promote+local+businesses+in+latin+america%2C+including+local+health+services+%E2%9C%A8627,2026-01-21 15:15:00,"social media design graphics,social media design inspiration,social media designs,social media design ideas,social media design graphics posts,social media design post,social media design ads,social media design background,social media design template,social media design graphics marketing",https://www.pinterest.com/pin/140806232536485/
a poster with the words team surrounded by people ✨575,https://i.pinimg.com/236x/ee/88/07/ee88073124f095d62f02ee19ad8ad6e2.jpg,Modern Canva Templates for Entrepreneurs,,"Jul 20, 2025 - This Pin was discovered by Daniela Romero. Discover (and save!) your own Pins on Pinterest",https://sites.google.com/view/socialglowstudio/?q=a+poster+with+the+words+team+surrounded+by+people+%E2%9C%A8575,2026-01-21 16:54:00,"social media design graphics,social media design inspiration,social media designs,social media design ideas,social media design graphics posts,social media design post,social media design ads,social media design background,social media design template,social media design graphics marketing",https://www.pinterest.com/pin/2040762328948436/
the social media templates are designed to look like they have been created in photoshopped ✨839,https://i.pinimg.com/236x/c3/53/2d/c3532dcade4529251ce026ba12bb0d8e.jpg,Modern Canva Templates for Entrepreneurs,,"Nov 1, 2025 - Design eye-catching social media posts with minimalist art and quotes using Canva! Perfect for simple, elegant Facebook ads, social media packs, and templates. 🎨✨ Simple tips to craft 5+ stunning posts in minutes. Stand out with clean, professional layouts. Ideal for marketers and content creators aiming for sleek, impactful visuals! 📱💡",https://sites.google.com/view/socialglowstudio/?q=the+social+media+templates+are+designed+to+look+like+they+have+been+created+in+photoshopped+%E2%9C%A8839,2026-01-21 18:31:00,"social media design graphics,social media design inspiration,social media designs,social media design ideas,social media design graphics posts,social media design post,social media design ads,social media design background,social media design template,social media design graphics marketing",https://www.pinterest.com/pin/1099933909020890571/
"Sushi Design Ideas, Feed Instagram Food Design, Food Product Poster, Food Poster Ideas, Menu Design Restaurant, Dimsum Poster Design, Flyer Makanan, Food Poster Design Graphics, Ramadan Food Delivery ✨880",https://i.pinimg.com/236x/f3/50/8c/f3508c8f954ada3cd5687aeb65e234e3.jpg,Modern Canva Templates for Entrepreneurs,,"Jul 1, 2025 - 🍽️✨ Looking for a free Instagram Canva template perfect for your restaurant? This stylish and easy-to-edit design helps you create eye-catching posts and stories to showcase your menu and attract new customers.🎨 Quickly customize with your photos, logo,...",https://sites.google.com/view/socialglowstudio/?q=Sushi+Design+Ideas%2C+Feed+Instagram+Food+Design%2C+Food+Product+Poster%2C+Food+Poster+Ideas%2C+Menu+Design+Restaurant%2C+Dimsum+Poster+Design%2C+Flyer+Makanan%2C+Food+Poster+Design+Graphics%2C+Ramadan+Food+Delivery+%E2%9C%A8880,2026-01-21 20:01:00,"social media design graphics,social media design inspiration,social media designs,social media design ideas,social media design graphics posts,social media design post,social media design ads,social media design background,social media design template,social media design graphics marketing",https://www.pinterest.com/pin/17662623533702641/
the social media post is shown with different images ✨469,https://i.pinimg.com/236x/a9/7c/03/a97c0334d96fdc281cbaaf1893916842.jpg,Modern Canva Templates for Entrepreneurs,,"Click here and download 30658+ different graphic Social Media Templates. Windows, Mac, Linux ✓ Licence included with all files ✓",https://sites.google.com/view/socialglowstudio/?q=the+social+media+post+is+shown+with+different+images+%E2%9C%A8469,2026-01-21 22:01:00,"social media design graphics,social media design inspiration,social media designs,social media design ideas,social media design graphics posts,social media design post,social media design ads,social media design background,social media design template,social media design graphics marketing",https://www.pinterest.com/pin/746964288358190629/
"an advertisement for a car detailing company with blue and black graphics on the front, two men ✨213",https://i.pinimg.com/236x/ba/1c/07/ba1c078704143b43b8d12e478b5ba078.jpg,Modern Canva Templates for Entrepreneurs,,"Jul 5, 2025 - Instagram is a huge social network with over 1 million activeusers – a user base that is continuing to grow even now with no signs of slowing down. It is quick to manage thanks to its largely visual nature, and has some of the best engagement on the web.Many companies use Instagram to boost their products and services …",https://sites.google.com/view/socialglowstudio/?q=an+advertisement+for+a+car+detailing+company+with+blue+and+black+graphics+on+the+front%2C+two+men+%E2%9C%A8213,2026-01-21 23:54:00,"social media design graphics,social media design inspiration,social media designs,social media design ideas,social media design graphics posts,social media design post,social media design ads,social media design background,social media design template,social media design graphics marketing",https://www.pinterest.com/pin/12947917675159082/
a red and white flyer with a man on a laptop ✨150,https://i.pinimg.com/236x/41/03/69/410369e27a28da5f48b9644d90e5f133.jpg,Modern Canva Templates for Entrepreneurs,,Download this Premium PSD of Psd grow business faster corporate social media banner design or instagram post template and explore millions of professional PSD files on Freepik.,https://sites.google.com/view/socialglowstudio/?q=a+red+and+white+flyer+with+a+man+on+a+laptop+%E2%9C%A8150,2026-01-22 01:50:00,"social media design graphics,social media design inspiration,social media designs,social media design ideas,social media design graphics posts,social media design post,social media design ads,social media design background,social media design template,social media design graphics marketing",https://www.pinterest.com/pin/3166662231282152/
"an iphone screen with various images and text on it, including the words'happy artisan ✨393",https://i.pinimg.com/236x/d8/c9/ca/d8c9ca462c6fcf619c05bb7e1bcc7739.jpg,Modern Canva Templates for Entrepreneurs,,31 de mar de 2025 - Smau_l encontrou este Pin. Encontre (e salve!) seus próprios Pins no Pinterest.,https://sites.google.com/view/socialglowstudio/?q=an+iphone+screen+with+various+images+and+text+on+it%2C+including+the+words%27happy+artisan+%E2%9C%A8393,2026-01-22 03:44:00,"social media design graphics,social media design inspiration,social media designs,social media design ideas,social media design graphics posts,social media design post,social media design ads,social media design background,social media design template,social media design graphics marketing",https://www.pinterest.com/pin/1829656094399027/
"an iphone screen with various images and text on the bottom right corner, below which reads best media ae ✨418",https://i.pinimg.com/236x/7d/59/ac/7d59ac7e3af97b3e856c904d396ff6d9.jpg,Modern Canva Templates for Entrepreneurs,,"Jul 2, 2025 - Graphic Design, Interaction Design, Product Design, Canva, WordPress, WordPress theme",https://sites.google.com/view/socialglowstudio/?q=an+iphone+screen+with+various+images+and+text+on+the+bottom+right+corner%2C+below+which+reads+best+media+ae+%E2%9C%A8418,2026-01-22 05:30:00,"social media design graphics,social media design inspiration,social media designs,social media design ideas,social media design graphics posts,social media design post,social media design ads,social media design background,social media design template,social media design graphics marketing",https://www.pinterest.com/pin/1829656094816097/
"several different types of business brochures are shown in this collage, including one with ✨502",https://i.pinimg.com/236x/e3/2f/ce/e32fce93024f3aae926e7b41f007cc56.jpg,Modern Canva Templates for Entrepreneurs,,"Jul 5, 2025 - Graphic Design, Illustration, Adobe Photoshop",https://sites.google.com/view/socialglowstudio/?q=several+different+types+of+business+brochures+are+shown+in+this+collage%2C+including+one+with+%E2%9C%A8502,2026-01-22 07:26:00,"social media design graphics,social media design inspiration,social media designs,social media design ideas,social media design graphics posts,social media design post,social media design ads,social media design background,social media design template,social media design graphics marketing",https://www.pinterest.com/pin/6403624465749553/
"Astrus Studio, especializado em mídias digitais. Trabalhamos no desenvolvimento de publicações para redes sociais, criação de identidades corporativas e edição de vídeo em motion design. Todos os projetos são executados com uma estratégia direcionada ao público-alvo de cada cliente, com foco na conversão de potenciais novos clientes! ✨502",https://i.pinimg.com/236x/ae/eb/74/aeeb74d7e1a7901f1445aaf5029728ea.jpg,Modern Canva Templates for Entrepreneurs,,"✦ Projeto estratégico para mídias digitais. Naming, Identidade Visual e Social Media.",https://sites.google.com/view/socialglowstudio/?q=Astrus+Studio%2C+especializado+em+m%C3%ADdias+digitais.+Trabalhamos+no+desenvolvimento+de+publica%C3%A7%C3%B5es+para+redes+sociais%2C+cria%C3%A7%C3%A3o+de+identidades+corporativas+e+edi%C3%A7%C3%A3o+de+v%C3%ADdeo+em+motion+design.+Todos+os+projetos+s%C3%A3o+executados+com+uma+estrat%C3%A9gia+direcionada+ao+p%C3%BAblico-alvo+de+cada+cliente%2C+com+foco+na+convers%C3%A3o+de+potenciais+novos+clientes%21+%E2%9C%A8502,2026-01-22 09:26:00,"social media design graphics,social media design inspiration,social media designs,social media design ideas,social media design graphics posts,social media design post,social media design ads,social media design background,social media design template,social media design graphics marketing",https://www.pinterest.com/pin/985231163311970/
an iphone screen showing the user's profile and other things to see on it ✨839,https://i.pinimg.com/236x/1d/07/d5/1d07d579ccf29ae15e41ae514cd9d162.jpg,Modern Canva Templates for Entrepreneurs,,"Aug 23, 2025 - This Pin was discovered by Social Media Design. Discover (and save!) your own Pins on Pinterest",https://sites.google.com/view/socialglowstudio/?q=an+iphone+screen+showing+the+user%27s+profile+and+other+things+to+see+on+it+%E2%9C%A8839,2026-01-22 11:10:00,"social media design graphics,social media design inspiration,social media designs,social media design ideas,social media design graphics posts,social media design post,social media design ads,social media design background,social media design template,social media design graphics marketing",https://www.pinterest.com/pin/4714774605211050/
an advertisement for ear piercings with the words in spanish and english on pink background ✨570,https://i.pinimg.com/236x/93/8b/1c/938b1cefdb23a44b24fe0fa5014b1933.jpg,Modern Canva Templates for Entrepreneurs,,"20 de fev de 2025 - Trendy Treasure for Social Media Success! Discover stylish and easy-to-use Instagram templates for every content type. Create a unique feed, captivate your audience, and save precious time. Your go-to",https://sites.google.com/view/socialglowstudio/?q=an+advertisement+for+ear+piercings+with+the+words+in+spanish+and+english+on+pink+background+%E2%9C%A8570,2026-01-22 13:00:00,"social media design graphics,social media design inspiration,social media designs,social media design ideas,social media design graphics posts,social media design post,social media design ads,social media design background,social media design template,social media design graphics marketing",https://www.pinterest.com/pin/295126581853658171/
the website is designed to look like it could be used for advertising and other purposes ✨990,https://i.pinimg.com/236x/e5/0f/f8/e50ff8b48f5fae2090b88002f39a2946.jpg,Modern Canva Templates for Entrepreneurs,,Angela encontrou este Pin. Encontre (e salve!) seus próprios Pins no Pinterest.,https://sites.google.com/view/socialglowstudio/?q=the+website+is+designed+to+look+like+it+could+be+used+for+advertising+and+other+purposes+%E2%9C%A8990,2026-01-22 14:37:00,"social media design graphics,social media design inspiration,social media designs,social media design ideas,social media design graphics posts,social media design post,social media design ads,social media design background,social media design template,social media design graphics marketing",https://www.pinterest.com/pin/281543724361171/
a woman is smiling while looking at her cell phone in front of a green background ✨569,https://i.pinimg.com/236x/f4/c4/8b/f4c48be4b55d21037adcf4e5531a4675.jpg,Modern Canva Templates for Entrepreneurs,,This Pin was discovered by Fer Arza Sacco. Discover (and save!) your own Pins on Pinterest,https://sites.google.com/view/socialglowstudio/?q=a+woman+is+smiling+while+looking+at+her+cell+phone+in+front+of+a+green+background+%E2%9C%A8569,2026-01-22 16:21:00,"social media design graphics,social media design inspiration,social media designs,social media design ideas,social media design graphics posts,social media design post,social media design ads,social media design background,social media design template,social media design graphics marketing",https://www.pinterest.com/pin/70437489133727/
a man wearing a hard hat and green safety gear with the words abril verde ✨197,https://i.pinimg.com/236x/a4/6f/70/a46f704928414c5be1def4d53a3c5967.jpg,Modern Canva Templates for Entrepreneurs,,This Pin was discovered by Social Media Design by Prof.. Discover (and save!) your own Pins on Pinterest,https://sites.google.com/view/socialglowstudio/?q=a+man+wearing+a+hard+hat+and+green+safety+gear+with+the+words+abril+verde+%E2%9C%A8197,2026-01-22 18:09:00,"social media design graphics,social media design inspiration,social media designs,social media design ideas,social media design graphics posts,social media design post,social media design ads,social media design background,social media design template,social media design graphics marketing",https://www.pinterest.com/pin/545498573637178656/
someone is holding up their cell phone with the text customer testimonal on it ✨903,https://i.pinimg.com/236x/27/07/39/2707392ea5603101ea637cdd8d593263.jpg,Modern Canva Templates for Entrepreneurs,,"Mar 28, 2025 - This Pin was discovered by Social Media Aesthetic Graphic. Discover (and save!) your own Pins on Pinterest",https://sites.google.com/view/socialglowstudio/?q=someone+is+holding+up+their+cell+phone+with+the+text+customer+testimonal+on+it+%E2%9C%A8903,2026-01-22 19:52:00,"social media design graphics,social media design inspiration,social media designs,social media design ideas,social media design graphics posts,social media design post,social media design ads,social media design background,social media design template,social media design graphics marketing",https://www.pinterest.com/pin/35817759533236050/
"an assortment of business cards with different font and colors, including blue, red, green, ✨902",https://i.pinimg.com/236x/ab/99/82/ab99827a9be7e5e60c5e3ca5303059f4.jpg,Modern Canva Templates for Entrepreneurs,,"Nov 3, 2025 - Make your Instagram presence stand out with this stunning bold Canva template! Perfect for engaging multiple slides, it’s easy to customize and helps communicate your message effectively. 📸✨ Use this template to increase engagement and make your posts memorable. Limited slots available — grab yours now and start designing like a pro! 🚀",https://sites.google.com/view/socialglowstudio/?q=an+assortment+of+business+cards+with+different+font+and+colors%2C+including+blue%2C+red%2C+green%2C+%E2%9C%A8902,2026-01-22 21:29:00,"social media design graphics,social media design inspiration,social media designs,social media design ideas,social media design graphics posts,social media design post,social media design ads,social media design background,social media design template,social media design graphics marketing",https://www.pinterest.com/pin/941533865901436814/
a series of photos showing different types of people in the process of creating an advertisement ✨743,https://i.pinimg.com/236x/2c/76/3c/2c763ce477e1513c01a459b0a9b88c1c.jpg,Modern Canva Templates for Entrepreneurs,,This Pin was discovered by Style Spectrum. Discover (and save!) your own Pins on Pinterest,https://sites.google.com/view/socialglowstudio/?q=a+series+of+photos+showing+different+types+of+people+in+the+process+of+creating+an+advertisement+%E2%9C%A8743,2026-01-22 23:22:00,"social media design graphics,social media design inspiration,social media designs,social media design ideas,social media design graphics posts,social media design post,social media design ads,social media design background,social media design template,social media design graphics marketing",https://www.pinterest.com/pin/113786328083566000/
"a collage of images with different colors and font on the same page, including an image ✨986",https://i.pinimg.com/236x/59/5d/e2/595de2ed320ae31d18d846d2d5340346.jpg,Modern Canva Templates for Entrepreneurs,,Social Media 2018 on Behance Source by luisafermc,https://sites.google.com/view/socialglowstudio/?q=a+collage+of+images+with+different+colors+and+font+on+the+same+page%2C+including+an+image+%E2%9C%A8986,2026-01-23 01:18:00,"social media design graphics,social media design inspiration,social media designs,social media design ideas,social media design graphics posts,social media design post,social media design ads,social media design background,social media design template,social media design graphics marketing",https://www.pinterest.com/pin/22236591905109519/
#Social_Media_Marketing_Portfolio #Social_Media_Manager_Quotes #Community_Manager_Aesthetic #Social_Media_Marketing_Aesthetic ✨356,https://i.pinimg.com/236x/e9/55/22/e95522bfb4a9260944f1d102e44bdb59.jpg,Modern Canva Templates for Entrepreneurs,,"Social Media Manager Template, Nude and Beige Digital Aesthetic #instastoryideas #igstoryideas #instagramstorytemplate #instagramstory",https://sites.google.com/view/socialglowstudio/?q=%23Social_Media_Marketing_Portfolio+%23Social_Media_Manager_Quotes+%23Community_Manager_Aesthetic+%23Social_Media_Marketing_Aesthetic+%E2%9C%A8356,2026-01-23 03:10:00,"social media design graphics,social media design inspiration,social media designs,social media design ideas,social media design graphics posts,social media design post,social media design ads,social media design background,social media design template,social media design graphics marketing",https://www.pinterest.com/pin/769834130098830960/
"Join thousands of small businesses leveraging over 2.5 million free Instagram templates 🎯. Perfect for marketing graphics, engagement strategies, and social media games. Make your brand visually appealing and grow your followers with eye-catching designs. Don't miss out—level up your social media game today! 📈🚀 Marketing Graphics, Engagement Strategies, Social Media Games, Business Mentor, Free Instagram, Instagram Marketing, Instagram Template, Social Media Template, Social Media Post ✨672",https://i.pinimg.com/236x/81/e1/a3/81e1a329c3cbb61564b38826507ccac6.jpg,Modern Canva Templates for Entrepreneurs,,"Nov 4, 2025 - Grow your brand effortlessly with over 2.5 million eye-catching social media templates 🎨. Perfect for Instagram marketing, engagement, and strategy, these free designs are ideal for small businesses and social media games. Get your business mentor’s edge today—stay ahead with sleek, ready-to-use graphics that captivate your audience and drive results! 🚀",https://sites.google.com/view/socialglowstudio/?q=Join+thousands+of+small+businesses+leveraging+over+2.5+million+free+Instagram+templates+%F0%9F%8E%AF.+Perfect+for+marketing+graphics%2C+engagement+strategies%2C+and+social+media+games.+Make+your+brand+visually+appealing+and+grow+your+followers+with+eye-catching+designs.+Don%27t+miss+out%E2%80%94level+up+your+social+media+game+today%21+%F0%9F%93%88%F0%9F%9A%80+Marketing+Graphics%2C+Engagement+Strategies%2C+Social+Media+Games%2C+Business+Mentor%2C+Free+Instagram%2C+Instagram+Marketing%2C+Instagram+Template%2C+Social+Media+Template%2C+Social+Media+Post+%E2%9C%A8672,2026-01-23 04:42:00,"social media design graphics,social media design inspiration,social media designs,social media design ideas,social media design graphics posts,social media design post,social media design ads,social media design background,social media design template,social media design graphics marketing",https://www.pinterest.com/pin/909656824757888263/
"brochures designed to promote local businesses in latin america, including local health services ✨950",https://i.pinimg.com/236x/45/83/37/4583373ff9de06c1253c47283b65674f.jpg,Modern Canva Templates for Entrepreneurs,,"Welcome to CreativeCanvaTemplates — your one-stop hub for stylish and free Canva templates! Whether you're looking to boost your Instagram game, create beautiful banners, or explore aesthetic post ideas, we've got everything you need. Let's make your social media shine!",https://sites.google.com/view/socialglowstudio/?q=brochures+designed+to+promote+local+businesses+in+latin+america%2C+including+local+health+services+%E2%9C%A8950,2026-01-23 06:36:00,"social media design graphics,social media design inspiration,social media designs,social media design ideas,social media design graphics posts,social media design post,social media design ads,social media design background,social media design template,social media design graphics marketing",https://www.pinterest.com/pin/140806232536485/
a poster with the words team surrounded by people ✨594,https://i.pinimg.com/236x/ee/88/07/ee88073124f095d62f02ee19ad8ad6e2.jpg,Modern Canva Templates for Entrepreneurs,,"Jul 20, 2025 - This Pin was discovered by Daniela Romero. Discover (and save!) your own Pins on Pinterest",https://sites.google.com/view/socialglowstudio/?q=a+poster+with+the+words+team+surrounded+by+people+%E2%9C%A8594,2026-01-23 08:12:00,"social media design graphics,social media design inspiration,social media designs,social media design ideas,social media design graphics posts,social media design post,social media design ads,social media design background,social media design template,social media design graphics marketing",https://www.pinterest.com/pin/2040762328948436/
