Title,Media URL,Pinterest board,Thumbnail,Description,Link,Publish date,Keywords,Pin URL
the social media templates are designed to look like they have been created in photoshopped ✨499,https://i.pinimg.com/236x/c3/53/2d/c3532dcade4529251ce026ba12bb0d8e.jpg,Modern Canva Templates for Entrepreneurs,,"Nov 1, 2025 - Design eye-catching social media posts with minimalist art and quotes using Canva! Perfect for simple, elegant Facebook ads, social media packs, and templates. 🎨✨ Simple tips to craft 5+ stunning posts in minutes. Stand out with clean, professional layouts. Ideal for marketers and content creators aiming for sleek, impactful visuals! 📱💡",https://sites.google.com/view/socialglowstudio/?q=the+social+media+templates+are+designed+to+look+like+they+have+been+created+in+photoshopped+%E2%9C%A8499,2026-01-23 09:53:00,"social media design graphics,social media design inspiration,social media designs,social media design ideas,social media design graphics posts,social media design post,social media design ads,social media design background,social media design template,social media design graphics marketing",https://www.pinterest.com/pin/1099933909020890571/
"Sushi Design Ideas, Feed Instagram Food Design, Food Product Poster, Food Poster Ideas, Menu Design Restaurant, Dimsum Poster Design, Flyer Makanan, Food Poster Design Graphics, Ramadan Food Delivery ✨730",https://i.pinimg.com/236x/f3/50/8c/f3508c8f954ada3cd5687aeb65e234e3.jpg,Modern Canva Templates for Entrepreneurs,,"Jul 1, 2025 - 🍽️✨ Looking for a free Instagram Canva template perfect for your restaurant? This stylish and easy-to-edit design helps you create eye-catching posts and stories to showcase your menu and attract new customers.🎨 Quickly customize with your photos, logo,...",https://sites.google.com/view/socialglowstudio/?q=Sushi+Design+Ideas%2C+Feed+Instagram+Food+Design%2C+Food+Product+Poster%2C+Food+Poster+Ideas%2C+Menu+Design+Restaurant%2C+Dimsum+Poster+Design%2C+Flyer+Makanan%2C+Food+Poster+Design+Graphics%2C+Ramadan+Food+Delivery+%E2%9C%A8730,2026-01-23 11:29:00,"social media design graphics,social media design inspiration,social media designs,social media design ideas,social media design graphics posts,social media design post,social media design ads,social media design background,social media design template,social media design graphics marketing",https://www.pinterest.com/pin/17662623533702641/
the social media post is shown with different images ✨629,https://i.pinimg.com/236x/a9/7c/03/a97c0334d96fdc281cbaaf1893916842.jpg,Modern Canva Templates for Entrepreneurs,,"Click here and download 30658+ different graphic Social Media Templates. Windows, Mac, Linux ✓ Licence included with all files ✓",https://sites.google.com/view/socialglowstudio/?q=the+social+media+post+is+shown+with+different+images+%E2%9C%A8629,2026-01-23 13:12:00,"social media design graphics,social media design inspiration,social media designs,social media design ideas,social media design graphics posts,social media design post,social media design ads,social media design background,social media design template,social media design graphics marketing",https://www.pinterest.com/pin/746964288358190629/
"an advertisement for a car detailing company with blue and black graphics on the front, two men ✨416",https://i.pinimg.com/236x/ba/1c/07/ba1c078704143b43b8d12e478b5ba078.jpg,Modern Canva Templates for Entrepreneurs,,"Jul 5, 2025 - Instagram is a huge social network with over 1 million activeusers – a user base that is continuing to grow even now with no signs of slowing down. It is quick to manage thanks to its largely visual nature, and has some of the best engagement on the web.Many companies use Instagram to boost their products and services …",https://sites.google.com/view/socialglowstudio/?q=an+advertisement+for+a+car+detailing+company+with+blue+and+black+graphics+on+the+front%2C+two+men+%E2%9C%A8416,2026-01-23 14:52:00,"social media design graphics,social media design inspiration,social media designs,social media design ideas,social media design graphics posts,social media design post,social media design ads,social media design background,social media design template,social media design graphics marketing",https://www.pinterest.com/pin/12947917675159082/
"Post Design. The Flow of Solacea 🌐 #AutomateYourLife #EfficientAutomation #StreamlineYourTasks #SimplifyYourRoutine #TimeSavingAutomation.. Instagram Product Post Ideas, Instagram Campaign Post Ideas, Giveaway Aesthetic Post, Beauty Social Media Post Design, Beauty Social Media Design, Beauty Brand Social Media Post, Cosmetics Social Media, Cosmetics Social Media Post, Beauty Product Social Media Post ✨759",https://i.pinimg.com/236x/79/d0/2c/79d02cd68d9d0810770bf05d80785aec.jpg,Modern Canva Templates for Entrepreneurs,,How Make.com Revolutionizes Both Business and Daily Tasks,https://sites.google.com/view/socialglowstudio/?q=Post+Design.+The+Flow+of+Solacea+%F0%9F%8C%90+%23AutomateYourLife+%23EfficientAutomation+%23StreamlineYourTasks+%23SimplifyYourRoutine+%23TimeSavingAutomation..+Instagram+Product+Post+Ideas%2C+Instagram+Campaign+Post+Ideas%2C+Giveaway+Aesthetic+Post%2C+Beauty+Social+Media+Post+Design%2C+Beauty+Social+Media+Design%2C+Beauty+Brand+Social+Media+Post%2C+Cosmetics+Social+Media%2C+Cosmetics+Social+Media+Post%2C+Beauty+Product+Social+Media+Post+%E2%9C%A8759,2026-01-23 16:30:00,"social media design graphics,social media design inspiration,social media designs,social media design ideas,social media design graphics posts,social media design post,social media design ads,social media design background,social media design template,social media design graphics marketing",https://www.pinterest.com/pin/795307615484521777/
"advertising brochure design with green and black colors, including an image of the phone ✨932",https://i.pinimg.com/236x/72/35/d3/7235d32c9382123c79798fa31edcb8ef.jpg,Modern Canva Templates for Entrepreneurs,,"Sep 19, 2025 - Craft Engaging Social Media Posts: Design Tips & Ideas",https://sites.google.com/view/socialglowstudio/?q=advertising+brochure+design+with+green+and+black+colors%2C+including+an+image+of+the+phone+%E2%9C%A8932,2026-01-23 18:03:00,"social media design graphics,social media design inspiration,social media designs,social media design ideas,social media design graphics posts,social media design post,social media design ads,social media design background,social media design template,social media design graphics marketing",https://www.pinterest.com/pin/246220304624705635/
an image of a website page with many different things in the screen and on it,https://i.pinimg.com/236x/82/25/ce/8225ce69e35346512dd35cbdd4d2b927.jpg,Modern Canva Templates for Entrepreneurs,,"Oct 26, 2025 - Get Marka - Marketing Value Social Media Post Template that includes marketing & digital marketing post, from our library of Social Media. Get unlimited downloads with an Envato subscription!",https://sites.google.com/view/socialglowstudio/?q=an+image+of+a+website+page+with+many+different+things+in+the+screen+and+on+it,2026-01-23 19:43:00,"social media design graphics,social media design inspiration,social media designs,social media design ideas,social media design graphics posts,social media design post,social media design ads,social media design background,social media design template,social media design graphics marketing",https://www.pinterest.com/pin/1071997517953589976/
what we offer social media strategy & management - social media consulting - creative art direction,https://i.pinimg.com/236x/ce/98/07/ce9807f4c0a35e6974ee3c57b5624d00.jpg,Modern Canva Templates for Entrepreneurs,,"May 3, 2025 - So, You Want to Conquer Social Media? Let's Get Organized! Ever feel like you're constantly chasing your tail, scrambling for content, and missing key opportunities? 🤔 Been there, done that. That's precisely why we poured our hearts (and lots of caffeine) into creating this ultimate collection of",https://sites.google.com/view/socialglowstudio/?q=what+we+offer+social+media+strategy+%26+management+-+social+media+consulting+-+creative+art+direction,2026-01-23 21:28:00,"social media design graphics,social media design inspiration,social media designs,social media design ideas,social media design graphics posts,social media design post,social media design ads,social media design background,social media design template,social media design graphics marketing",https://www.pinterest.com/pin/37436240649976941/
"an image of a set of business postcards with the words, news and people",https://i.pinimg.com/236x/17/e6/15/17e615c85ae23fa0d181400124891179.jpg,Modern Canva Templates for Entrepreneurs,,"Oct 26, 2025 - Looking for engaging postcard templates for social media success? Our stunning, customizable designs are perfect for enhancing your Instagram feed and boosting your social media branding. Ideal for marketers, designers, and small business owners, these templates help you create visually captivating posts that stand out! Perfect for your next seasonal marketing campaign! ✨ Save this pin and start designing today!",https://sites.google.com/view/socialglowstudio/?q=an+image+of+a+set+of+business+postcards+with+the+words%2C+news+and+people,2026-01-23 23:24:00,"social media design graphics,social media design inspiration,social media designs,social media design ideas,social media design graphics posts,social media design post,social media design ads,social media design background,social media design template,social media design graphics marketing",https://www.pinterest.com/pin/659495939224336914/
Programming Tech Graphics Design Digital Marketing Writing Translation Video Animation AI Services Music Audio Business Consulting ✨476,https://i.pinimg.com/236x/07/35/6c/07356c29bc1179c9f674ae12bcf62495.jpg,Modern Canva Templates for Entrepreneurs,,"Mar 23, 2025 - This Pin was discovered by Social Media Design Trends. Discover (and save!) your own Pins on Pinterest",https://sites.google.com/view/socialglowstudio/?q=Programming+Tech+Graphics+Design+Digital+Marketing+Writing+Translation+Video+Animation+AI+Services+Music+Audio+Business+Consulting+%E2%9C%A8476,2026-01-24 01:02:00,"social media design graphics,social media design inspiration,social media designs,social media design ideas,social media design graphics posts,social media design post,social media design ads,social media design background,social media design template,social media design graphics marketing",https://www.pinterest.com/pin/41869471531602601/
"an advertisement for a dance studio with purple and white colors on the front, side and back ✨793",https://i.pinimg.com/236x/da/3a/e5/da3ae5f1f4f0fb39ccf536ffc2a9b617.jpg,Modern Canva Templates for Entrepreneurs,,"Looking for Graphic Design Services? Browse Fiverr Freelancers by skills, reviews, and price. Select the right Freelancer to meet your needs and budget.",https://sites.google.com/view/socialglowstudio/?q=an+advertisement+for+a+dance+studio+with+purple+and+white+colors+on+the+front%2C+side+and+back+%E2%9C%A8793,2026-01-24 02:37:00,"social media design graphics,social media design inspiration,social media designs,social media design ideas,social media design graphics posts,social media design post,social media design ads,social media design background,social media design template,social media design graphics marketing",https://www.pinterest.com/pin/189432728073233617/
Logo Design Tips & Tutorials,https://i.pinimg.com/236x/65/9d/de/659ddeb2c40495f9a3abaecaf0800211.jpg,Modern Canva Templates for Entrepreneurs,,"Mar 31, 2025 - This Pin was discovered by Social Media Aesthetic Graphic. Discover (and save!) your own Pins on Pinterest",https://sites.google.com/view/socialglowstudio/?q=Logo+Design+Tips+%26+Tutorials,2026-01-24 04:10:00,"social media design graphics,social media design inspiration,social media designs,social media design ideas,social media design graphics posts,social media design post,social media design ads,social media design background,social media design template,social media design graphics marketing",https://www.pinterest.com/pin/50384089576369864/
"a collage of images with different colors and font on the same page, including an image ✨499",https://i.pinimg.com/236x/59/5d/e2/595de2ed320ae31d18d846d2d5340346.jpg,Modern Canva Templates for Entrepreneurs,,Social Media 2018 on Behance Source by luisafermc,https://sites.google.com/view/socialglowstudio/?q=a+collage+of+images+with+different+colors+and+font+on+the+same+page%2C+including+an+image+%E2%9C%A8499,2026-01-24 05:58:00,"social media design graphics,social media design inspiration,social media designs,social media design ideas,social media design graphics posts,social media design post,social media design ads,social media design background,social media design template,social media design graphics marketing",https://www.pinterest.com/pin/22236591905109519/
#Social_Media_Marketing_Portfolio #Social_Media_Manager_Quotes #Community_Manager_Aesthetic #Social_Media_Marketing_Aesthetic ✨856,https://i.pinimg.com/236x/e9/55/22/e95522bfb4a9260944f1d102e44bdb59.jpg,Modern Canva Templates for Entrepreneurs,,"Social Media Manager Template, Nude and Beige Digital Aesthetic #instastoryideas #igstoryideas #instagramstorytemplate #instagramstory",https://sites.google.com/view/socialglowstudio/?q=%23Social_Media_Marketing_Portfolio+%23Social_Media_Manager_Quotes+%23Community_Manager_Aesthetic+%23Social_Media_Marketing_Aesthetic+%E2%9C%A8856,2026-01-24 07:40:00,"social media design graphics,social media design inspiration,social media designs,social media design ideas,social media design graphics posts,social media design post,social media design ads,social media design background,social media design template,social media design graphics marketing",https://www.pinterest.com/pin/769834130098830960/
"Join thousands of small businesses leveraging over 2.5 million free Instagram templates 🎯. Perfect for marketing graphics, engagement strategies, and social media games. Make your brand visually appealing and grow your followers with eye-catching designs. Don't miss out—level up your social media game today! 📈🚀 Marketing Graphics, Engagement Strategies, Social Media Games, Business Mentor, Free Instagram, Instagram Marketing, Instagram Template, Social Media Template, Social Media Post ✨670",https://i.pinimg.com/236x/81/e1/a3/81e1a329c3cbb61564b38826507ccac6.jpg,Modern Canva Templates for Entrepreneurs,,"Nov 4, 2025 - Grow your brand effortlessly with over 2.5 million eye-catching social media templates 🎨. Perfect for Instagram marketing, engagement, and strategy, these free designs are ideal for small businesses and social media games. Get your business mentor’s edge today—stay ahead with sleek, ready-to-use graphics that captivate your audience and drive results! 🚀",https://sites.google.com/view/socialglowstudio/?q=Join+thousands+of+small+businesses+leveraging+over+2.5+million+free+Instagram+templates+%F0%9F%8E%AF.+Perfect+for+marketing+graphics%2C+engagement+strategies%2C+and+social+media+games.+Make+your+brand+visually+appealing+and+grow+your+followers+with+eye-catching+designs.+Don%27t+miss+out%E2%80%94level+up+your+social+media+game+today%21+%F0%9F%93%88%F0%9F%9A%80+Marketing+Graphics%2C+Engagement+Strategies%2C+Social+Media+Games%2C+Business+Mentor%2C+Free+Instagram%2C+Instagram+Marketing%2C+Instagram+Template%2C+Social+Media+Template%2C+Social+Media+Post+%E2%9C%A8670,2026-01-24 09:24:00,"social media design graphics,social media design inspiration,social media designs,social media design ideas,social media design graphics posts,social media design post,social media design ads,social media design background,social media design template,social media design graphics marketing",https://www.pinterest.com/pin/909656824757888263/
"brochures designed to promote local businesses in latin america, including local health services ✨469",https://i.pinimg.com/236x/45/83/37/4583373ff9de06c1253c47283b65674f.jpg,Modern Canva Templates for Entrepreneurs,,"Welcome to CreativeCanvaTemplates — your one-stop hub for stylish and free Canva templates! Whether you're looking to boost your Instagram game, create beautiful banners, or explore aesthetic post ideas, we've got everything you need. Let's make your social media shine!",https://sites.google.com/view/socialglowstudio/?q=brochures+designed+to+promote+local+businesses+in+latin+america%2C+including+local+health+services+%E2%9C%A8469,2026-01-24 11:02:00,"social media design graphics,social media design inspiration,social media designs,social media design ideas,social media design graphics posts,social media design post,social media design ads,social media design background,social media design template,social media design graphics marketing",https://www.pinterest.com/pin/140806232536485/
a poster with the words team surrounded by people ✨378,https://i.pinimg.com/236x/ee/88/07/ee88073124f095d62f02ee19ad8ad6e2.jpg,Modern Canva Templates for Entrepreneurs,,"Jul 20, 2025 - This Pin was discovered by Daniela Romero. Discover (and save!) your own Pins on Pinterest",https://sites.google.com/view/socialglowstudio/?q=a+poster+with+the+words+team+surrounded+by+people+%E2%9C%A8378,2026-01-24 12:46:00,"social media design graphics,social media design inspiration,social media designs,social media design ideas,social media design graphics posts,social media design post,social media design ads,social media design background,social media design template,social media design graphics marketing",https://www.pinterest.com/pin/2040762328948436/
the social media templates are designed to look like they have been created in photoshopped ✨705,https://i.pinimg.com/236x/c3/53/2d/c3532dcade4529251ce026ba12bb0d8e.jpg,Modern Canva Templates for Entrepreneurs,,"Nov 1, 2025 - Design eye-catching social media posts with minimalist art and quotes using Canva! Perfect for simple, elegant Facebook ads, social media packs, and templates. 🎨✨ Simple tips to craft 5+ stunning posts in minutes. Stand out with clean, professional layouts. Ideal for marketers and content creators aiming for sleek, impactful visuals! 📱💡",https://sites.google.com/view/socialglowstudio/?q=the+social+media+templates+are+designed+to+look+like+they+have+been+created+in+photoshopped+%E2%9C%A8705,2026-01-24 14:45:00,"social media design graphics,social media design inspiration,social media designs,social media design ideas,social media design graphics posts,social media design post,social media design ads,social media design background,social media design template,social media design graphics marketing",https://www.pinterest.com/pin/1099933909020890571/
"Sushi Design Ideas, Feed Instagram Food Design, Food Product Poster, Food Poster Ideas, Menu Design Restaurant, Dimsum Poster Design, Flyer Makanan, Food Poster Design Graphics, Ramadan Food Delivery ✨274",https://i.pinimg.com/236x/f3/50/8c/f3508c8f954ada3cd5687aeb65e234e3.jpg,Modern Canva Templates for Entrepreneurs,,"Jul 1, 2025 - 🍽️✨ Looking for a free Instagram Canva template perfect for your restaurant? This stylish and easy-to-edit design helps you create eye-catching posts and stories to showcase your menu and attract new customers.🎨 Quickly customize with your photos, logo,...",https://sites.google.com/view/socialglowstudio/?q=Sushi+Design+Ideas%2C+Feed+Instagram+Food+Design%2C+Food+Product+Poster%2C+Food+Poster+Ideas%2C+Menu+Design+Restaurant%2C+Dimsum+Poster+Design%2C+Flyer+Makanan%2C+Food+Poster+Design+Graphics%2C+Ramadan+Food+Delivery+%E2%9C%A8274,2026-01-24 16:35:00,"social media design graphics,social media design inspiration,social media designs,social media design ideas,social media design graphics posts,social media design post,social media design ads,social media design background,social media design template,social media design graphics marketing",https://www.pinterest.com/pin/17662623533702641/
the social media post is shown with different images ✨123,https://i.pinimg.com/236x/a9/7c/03/a97c0334d96fdc281cbaaf1893916842.jpg,Modern Canva Templates for Entrepreneurs,,"Click here and download 30658+ different graphic Social Media Templates. Windows, Mac, Linux ✓ Licence included with all files ✓",https://sites.google.com/view/socialglowstudio/?q=the+social+media+post+is+shown+with+different+images+%E2%9C%A8123,2026-01-24 18:15:00,"social media design graphics,social media design inspiration,social media designs,social media design ideas,social media design graphics posts,social media design post,social media design ads,social media design background,social media design template,social media design graphics marketing",https://www.pinterest.com/pin/746964288358190629/
"an advertisement for a car detailing company with blue and black graphics on the front, two men ✨454",https://i.pinimg.com/236x/ba/1c/07/ba1c078704143b43b8d12e478b5ba078.jpg,Modern Canva Templates for Entrepreneurs,,"Jul 5, 2025 - Instagram is a huge social network with over 1 million activeusers – a user base that is continuing to grow even now with no signs of slowing down. It is quick to manage thanks to its largely visual nature, and has some of the best engagement on the web.Many companies use Instagram to boost their products and services …",https://sites.google.com/view/socialglowstudio/?q=an+advertisement+for+a+car+detailing+company+with+blue+and+black+graphics+on+the+front%2C+two+men+%E2%9C%A8454,2026-01-24 20:10:00,"social media design graphics,social media design inspiration,social media designs,social media design ideas,social media design graphics posts,social media design post,social media design ads,social media design background,social media design template,social media design graphics marketing",https://www.pinterest.com/pin/12947917675159082/
"Post Design. The Flow of Solacea 🌐 #AutomateYourLife #EfficientAutomation #StreamlineYourTasks #SimplifyYourRoutine #TimeSavingAutomation.. Instagram Product Post Ideas, Instagram Campaign Post Ideas, Giveaway Aesthetic Post, Beauty Social Media Post Design, Beauty Social Media Design, Beauty Brand Social Media Post, Cosmetics Social Media, Cosmetics Social Media Post, Beauty Product Social Media Post ✨319",https://i.pinimg.com/236x/79/d0/2c/79d02cd68d9d0810770bf05d80785aec.jpg,Modern Canva Templates for Entrepreneurs,,How Make.com Revolutionizes Both Business and Daily Tasks,https://sites.google.com/view/socialglowstudio/?q=Post+Design.+The+Flow+of+Solacea+%F0%9F%8C%90+%23AutomateYourLife+%23EfficientAutomation+%23StreamlineYourTasks+%23SimplifyYourRoutine+%23TimeSavingAutomation..+Instagram+Product+Post+Ideas%2C+Instagram+Campaign+Post+Ideas%2C+Giveaway+Aesthetic+Post%2C+Beauty+Social+Media+Post+Design%2C+Beauty+Social+Media+Design%2C+Beauty+Brand+Social+Media+Post%2C+Cosmetics+Social+Media%2C+Cosmetics+Social+Media+Post%2C+Beauty+Product+Social+Media+Post+%E2%9C%A8319,2026-01-24 21:50:00,"social media design graphics,social media design inspiration,social media designs,social media design ideas,social media design graphics posts,social media design post,social media design ads,social media design background,social media design template,social media design graphics marketing",https://www.pinterest.com/pin/795307615484521777/
Social media post ✨855,https://i.pinimg.com/236x/69/c0/23/69c023bcb57be4466dd2139ebd372b75.jpg,Modern Canva Templates for Entrepreneurs,,"Advertising, Graphic Design, Illustration, Adobe Photoshop, Adobe Illustrator, Adobe Stock",https://sites.google.com/view/socialglowstudio/?q=Social+media+post+%E2%9C%A8855,2026-01-24 23:50:00,"social media design graphics,social media design inspiration,social media designs,social media design ideas,social media design graphics posts,social media design post,social media design ads,social media design background,social media design template,social media design graphics marketing",https://www.pinterest.com/pin/404479610304964765/
