Title,Media URL,Pinterest board,Thumbnail,Description,Link,Publish date,Keywords,Pin URL
"Looking ahead to 2025? This pin explores fresh, innovative Instagram feed ideas to keep your content captivating and ahead of the curve. Discover trending aesthetics, engaging formats, and strategic posting techniques to maximize your reach and grow your audience. From bold visuals to interactive stories, find inspiration to elevate your Instagram presence in the new year and beyond. Get ahead of the game – plan your 2025 Instagram feed now. Feed Post Ideas, Template Instagram Post, Instagram Feed Ideas Business, Social Media Feed Design, Shop Banner Design Ideas, Nike Instagram Feed, Event Instagram Feed, Brand Instagram Feed Ideas, Post Instagram Design ✨492",https://i.pinimg.com/236x/df/15/32/df153244956464836801459c2b596dfc.jpg,Modern Canva Templates for Entrepreneurs,,"18 nov 2024 - Instagram is a huge social network with over 1 million activeusers – a user base that is continuing to grow even now with no signs of slowing down. It is quick to manage thanks to its largely visual nature, and has some of the best engagement on the web.Many companies use Instagram to boost their products and services …",https://sites.google.com/view/socialglowstudio/?q=Looking+ahead+to+2025%3F+This+pin+explores+fresh%2C+innovative+Instagram+feed+ideas+to+keep+your+content+captivating+and+ahead+of+the+curve.+Discover+trending+aesthetics%2C+engaging+formats%2C+and+strategic+posting+techniques+to+maximize+your+reach+and+grow+your+audience.+From+bold+visuals+to+interactive+stories%2C+find+inspiration+to+elevate+your+Instagram+presence+in+the+new+year+and+beyond.+Get+ahead+of+the+game+%E2%80%93+plan+your+2025+Instagram+feed+now.+Feed+Post+Ideas%2C+Template+Instagram+Post%2C+Instagram+Feed+Ideas+Business%2C+Social+Media+Feed+Design%2C+Shop+Banner+Design+Ideas%2C+Nike+Instagram+Feed%2C+Event+Instagram+Feed%2C+Brand+Instagram+Feed+Ideas%2C+Post+Instagram+Design+%E2%9C%A8492,2026-01-25 01:34:00,"social media design graphics,social media design inspiration,social media designs,social media design ideas,social media design graphics posts,social media design post,social media design ads,social media design background,social media design template,social media design graphics marketing",https://www.pinterest.com/pin/114208540547361830/
a white poster with the words'70 killer content ideas to post on social media ✨830,https://i.pinimg.com/236x/cd/60/72/cd6072bf41e418d8447b305354723e18.jpg,Modern Canva Templates for Entrepreneurs,,"Mar 7, 2025 - My name is Alena. I am an artist. The main theme of my work is female beauty.",https://sites.google.com/view/socialglowstudio/?q=a+white+poster+with+the+words%2770+killer+content+ideas+to+post+on+social+media+%E2%9C%A8830,2026-01-25 03:28:00,"social media design graphics,social media design inspiration,social media designs,social media design ideas,social media design graphics posts,social media design post,social media design ads,social media design background,social media design template,social media design graphics marketing",https://www.pinterest.com/pin/1025061565190098094/
a white poster with the words how to create a killer social media marketing strategy on it ✨887,https://i.pinimg.com/236x/7a/87/44/7a8744f456a1ee85375030293dec8cf2.jpg,Modern Canva Templates for Entrepreneurs,,"Jan 7, 2025 - Discover how to grow your business with a proven social media marketing strategy that drives real results and improves online sales.",https://sites.google.com/view/socialglowstudio/?q=a+white+poster+with+the+words+how+to+create+a+killer+social+media+marketing+strategy+on+it+%E2%9C%A8887,2026-01-25 05:16:00,"social media design graphics,social media design inspiration,social media designs,social media design ideas,social media design graphics posts,social media design post,social media design ads,social media design background,social media design template,social media design graphics marketing",https://www.pinterest.com/pin/9359111722002078/
an image of the back cover of a magazine or brochure with yellow and black colors ✨764,https://i.pinimg.com/236x/c1/a9/37/c1a9373e734b0d6d7846a249bd5c8b78.jpg,Modern Canva Templates for Entrepreneurs,,"Fiverr freelancer will provide Web Banners services and design web banner kit, ads, hero image, header, and slider including Source file within 1 day",https://sites.google.com/view/socialglowstudio/?q=an+image+of+the+back+cover+of+a+magazine+or+brochure+with+yellow+and+black+colors+%E2%9C%A8764,2026-01-25 06:57:00,"social media design graphics,social media design inspiration,social media designs,social media design ideas,social media design graphics posts,social media design post,social media design ads,social media design background,social media design template,social media design graphics marketing",https://www.pinterest.com/pin/4574037116648540/
"the collage is made up of many different images and words on it, including one woman's face ✨404",https://i.pinimg.com/236x/c2/3c/e9/c23ce9846c6f1e63a9fe5fee092d45ac.jpg,Modern Canva Templates for Entrepreneurs,,"Aug 26, 2025 - This Pin was discovered by anne.. Discover (and save!) your own Pins on Pinterest",https://sites.google.com/view/socialglowstudio/?q=the+collage+is+made+up+of+many+different+images+and+words+on+it%2C+including+one+woman%27s+face+%E2%9C%A8404,2026-01-25 08:41:00,"social media design graphics,social media design inspiration,social media designs,social media design ideas,social media design graphics posts,social media design post,social media design ads,social media design background,social media design template,social media design graphics marketing",https://www.pinterest.com/pin/7177680652337182/
Designing Social Impact: Kamila Machado's Innovative Studio ✨700,https://i.pinimg.com/236x/f9/0c/6f/f90c6f7a06e53cb33ee7b8afadbe7b01.jpg,Modern Canva Templates for Entrepreneurs,,Get instant access to your social media calendar and boost your marketing. Plan your social media content with a calendar and skyrocket your business.,https://sites.google.com/view/socialglowstudio/?q=Designing+Social+Impact%3A+Kamila+Machado%27s+Innovative+Studio+%E2%9C%A8700,2026-01-25 10:16:00,"social media design graphics,social media design inspiration,social media designs,social media design ideas,social media design graphics posts,social media design post,social media design ads,social media design background,social media design template,social media design graphics marketing",https://www.pinterest.com/pin/49750770880062638/
the back cover of an electronic device with various images and text on it's side ✨533,https://i.pinimg.com/236x/f1/73/ae/f173aebecd9b897c810ce01f5b8a4425.jpg,Modern Canva Templates for Entrepreneurs,,"80 INSTAGRAM POST & STORY TEMPLATES 100% EDITABLE and CUSTOMIZABLE CANVA Templates for Instagram, Facebook, LinkedIn or any other social media platform. Perfect",https://sites.google.com/view/socialglowstudio/?q=the+back+cover+of+an+electronic+device+with+various+images+and+text+on+it%27s+side+%E2%9C%A8533,2026-01-25 12:05:00,"social media design graphics,social media design inspiration,social media designs,social media design ideas,social media design graphics posts,social media design post,social media design ads,social media design background,social media design template,social media design graphics marketing",https://www.pinterest.com/pin/1029776271027558641/
a flyer for a burger restaurant ✨936,https://i.pinimg.com/236x/ed/64/76/ed6476a03d12c57126df49505713514d.jpg,Modern Canva Templates for Entrepreneurs,,Download this premium PSD file for a fast food social media post template. Explore more high-quality graphic design resources on Freepik.,https://sites.google.com/view/socialglowstudio/?q=a+flyer+for+a+burger+restaurant+%E2%9C%A8936,2026-01-25 13:49:00,"social media design graphics,social media design inspiration,social media designs,social media design ideas,social media design graphics posts,social media design post,social media design ads,social media design background,social media design template,social media design graphics marketing",https://www.pinterest.com/pin/1548181153145325/
"Nutrition Marketing Ideas, Wellness Advertising, Creative Social Media Ideas, Social Media Post Business, Interactive Social Media, Creative Design Social Media, Wellness Post Ideas, Nutrition Creativ ✨608",https://i.pinimg.com/236x/96/c9/73/96c973cd954fff81c2fa918b743a4dad.jpg,Modern Canva Templates for Entrepreneurs,,This Pin was discovered by Social Media Design by Prof.. Discover (and save!) your own Pins on Pinterest,https://sites.google.com/view/socialglowstudio/?q=Nutrition+Marketing+Ideas%2C+Wellness+Advertising%2C+Creative+Social+Media+Ideas%2C+Social+Media+Post+Business%2C+Interactive+Social+Media%2C+Creative+Design+Social+Media%2C+Wellness+Post+Ideas%2C+Nutrition+Creativ+%E2%9C%A8608,2026-01-25 15:26:00,"social media design graphics,social media design inspiration,social media designs,social media design ideas,social media design graphics posts,social media design post,social media design ads,social media design background,social media design template,social media design graphics marketing",https://www.pinterest.com/pin/30680841208534266/
a purple and black poster with the words find your style and your self on it ✨671,https://i.pinimg.com/236x/66/68/c3/6668c3885cfef05965ca349e417c7eee.jpg,Modern Canva Templates for Entrepreneurs,,Descarga este PSD Premium de Plantilla de feed de publicación dinámica moderna de Instagram y descubre millones de archivos PSD profesionales en Freepik.,https://sites.google.com/view/socialglowstudio/?q=a+purple+and+black+poster+with+the+words+find+your+style+and+your+self+on+it+%E2%9C%A8671,2026-01-25 16:59:00,"social media design graphics,social media design inspiration,social media designs,social media design ideas,social media design graphics posts,social media design post,social media design ads,social media design background,social media design template,social media design graphics marketing",https://www.pinterest.com/pin/2814818511025608/
"the cover art for an upcoming album, which features images of people and words that appear to be in red ✨225",https://i.pinimg.com/236x/30/0f/79/300f7993e592035e11f61a91d24c0c5b.jpg,Modern Canva Templates for Entrepreneurs,,Readys Social Media Kit ~ Web Elements ~ Creative Market,https://sites.google.com/view/socialglowstudio/?q=the+cover+art+for+an+upcoming+album%2C+which+features+images+of+people+and+words+that+appear+to+be+in+red+%E2%9C%A8225,2026-01-25 18:39:00,"social media design graphics,social media design inspiration,social media designs,social media design ideas,social media design graphics posts,social media design post,social media design ads,social media design background,social media design template,social media design graphics marketing",https://www.pinterest.com/pin/1124281494451171934/
an image of some people that are in the green field with avocados on them ✨212,https://i.pinimg.com/236x/93/8c/c8/938cc81944cf6bddcddc74af5c193569.jpg,Modern Canva Templates for Entrepreneurs,,"Feb 8, 2025 - Graphic Design, Advertising, Creative Direction, Adobe Photoshop, Adobe Illustrator",https://sites.google.com/view/socialglowstudio/?q=an+image+of+some+people+that+are+in+the+green+field+with+avocados+on+them+%E2%9C%A8212,2026-01-25 20:24:00,"social media design graphics,social media design inspiration,social media designs,social media design ideas,social media design graphics posts,social media design post,social media design ads,social media design background,social media design template,social media design graphics marketing",https://www.pinterest.com/pin/492649953690920/
"an assortment of business cards with different font and colors, including blue, red, green, ✨234",https://i.pinimg.com/236x/ab/99/82/ab99827a9be7e5e60c5e3ca5303059f4.jpg,Modern Canva Templates for Entrepreneurs,,"Nov 3, 2025 - Make your Instagram presence stand out with this stunning bold Canva template! Perfect for engaging multiple slides, it’s easy to customize and helps communicate your message effectively. 📸✨ Use this template to increase engagement and make your posts memorable. Limited slots available — grab yours now and start designing like a pro! 🚀",https://sites.google.com/view/socialglowstudio/?q=an+assortment+of+business+cards+with+different+font+and+colors%2C+including+blue%2C+red%2C+green%2C+%E2%9C%A8234,2026-01-25 22:23:00,"social media design graphics,social media design inspiration,social media designs,social media design ideas,social media design graphics posts,social media design post,social media design ads,social media design background,social media design template,social media design graphics marketing",https://www.pinterest.com/pin/941533865901436814/
a series of photos showing different types of people in the process of creating an advertisement ✨601,https://i.pinimg.com/236x/2c/76/3c/2c763ce477e1513c01a459b0a9b88c1c.jpg,Modern Canva Templates for Entrepreneurs,,This Pin was discovered by Style Spectrum. Discover (and save!) your own Pins on Pinterest,https://sites.google.com/view/socialglowstudio/?q=a+series+of+photos+showing+different+types+of+people+in+the+process+of+creating+an+advertisement+%E2%9C%A8601,2026-01-25 23:58:00,"social media design graphics,social media design inspiration,social media designs,social media design ideas,social media design graphics posts,social media design post,social media design ads,social media design background,social media design template,social media design graphics marketing",https://www.pinterest.com/pin/113786328083566000/
"a collage of images with different colors and font on the same page, including an image ✨808",https://i.pinimg.com/236x/59/5d/e2/595de2ed320ae31d18d846d2d5340346.jpg,Modern Canva Templates for Entrepreneurs,,Social Media 2018 on Behance Source by luisafermc,https://sites.google.com/view/socialglowstudio/?q=a+collage+of+images+with+different+colors+and+font+on+the+same+page%2C+including+an+image+%E2%9C%A8808,2026-01-26 01:47:00,"social media design graphics,social media design inspiration,social media designs,social media design ideas,social media design graphics posts,social media design post,social media design ads,social media design background,social media design template,social media design graphics marketing",https://www.pinterest.com/pin/22236591905109519/
#Social_Media_Marketing_Portfolio #Social_Media_Manager_Quotes #Community_Manager_Aesthetic #Social_Media_Marketing_Aesthetic ✨678,https://i.pinimg.com/236x/e9/55/22/e95522bfb4a9260944f1d102e44bdb59.jpg,Modern Canva Templates for Entrepreneurs,,"Social Media Manager Template, Nude and Beige Digital Aesthetic #instastoryideas #igstoryideas #instagramstorytemplate #instagramstory",https://sites.google.com/view/socialglowstudio/?q=%23Social_Media_Marketing_Portfolio+%23Social_Media_Manager_Quotes+%23Community_Manager_Aesthetic+%23Social_Media_Marketing_Aesthetic+%E2%9C%A8678,2026-01-26 03:35:00,"social media design graphics,social media design inspiration,social media designs,social media design ideas,social media design graphics posts,social media design post,social media design ads,social media design background,social media design template,social media design graphics marketing",https://www.pinterest.com/pin/769834130098830960/
"Join thousands of small businesses leveraging over 2.5 million free Instagram templates 🎯. Perfect for marketing graphics, engagement strategies, and social media games. Make your brand visually appealing and grow your followers with eye-catching designs. Don't miss out—level up your social media game today! 📈🚀 Marketing Graphics, Engagement Strategies, Social Media Games, Business Mentor, Free Instagram, Instagram Marketing, Instagram Template, Social Media Template, Social Media Post ✨292",https://i.pinimg.com/236x/81/e1/a3/81e1a329c3cbb61564b38826507ccac6.jpg,Modern Canva Templates for Entrepreneurs,,"Nov 4, 2025 - Grow your brand effortlessly with over 2.5 million eye-catching social media templates 🎨. Perfect for Instagram marketing, engagement, and strategy, these free designs are ideal for small businesses and social media games. Get your business mentor’s edge today—stay ahead with sleek, ready-to-use graphics that captivate your audience and drive results! 🚀",https://sites.google.com/view/socialglowstudio/?q=Join+thousands+of+small+businesses+leveraging+over+2.5+million+free+Instagram+templates+%F0%9F%8E%AF.+Perfect+for+marketing+graphics%2C+engagement+strategies%2C+and+social+media+games.+Make+your+brand+visually+appealing+and+grow+your+followers+with+eye-catching+designs.+Don%27t+miss+out%E2%80%94level+up+your+social+media+game+today%21+%F0%9F%93%88%F0%9F%9A%80+Marketing+Graphics%2C+Engagement+Strategies%2C+Social+Media+Games%2C+Business+Mentor%2C+Free+Instagram%2C+Instagram+Marketing%2C+Instagram+Template%2C+Social+Media+Template%2C+Social+Media+Post+%E2%9C%A8292,2026-01-26 05:13:00,"social media design graphics,social media design inspiration,social media designs,social media design ideas,social media design graphics posts,social media design post,social media design ads,social media design background,social media design template,social media design graphics marketing",https://www.pinterest.com/pin/909656824757888263/
"brochures designed to promote local businesses in latin america, including local health services ✨983",https://i.pinimg.com/236x/45/83/37/4583373ff9de06c1253c47283b65674f.jpg,Modern Canva Templates for Entrepreneurs,,"Welcome to CreativeCanvaTemplates — your one-stop hub for stylish and free Canva templates! Whether you're looking to boost your Instagram game, create beautiful banners, or explore aesthetic post ideas, we've got everything you need. Let's make your social media shine!",https://sites.google.com/view/socialglowstudio/?q=brochures+designed+to+promote+local+businesses+in+latin+america%2C+including+local+health+services+%E2%9C%A8983,2026-01-26 07:04:00,"social media design graphics,social media design inspiration,social media designs,social media design ideas,social media design graphics posts,social media design post,social media design ads,social media design background,social media design template,social media design graphics marketing",https://www.pinterest.com/pin/140806232536485/
a poster with the words team surrounded by people ✨911,https://i.pinimg.com/236x/ee/88/07/ee88073124f095d62f02ee19ad8ad6e2.jpg,Modern Canva Templates for Entrepreneurs,,"Jul 20, 2025 - This Pin was discovered by Daniela Romero. Discover (and save!) your own Pins on Pinterest",https://sites.google.com/view/socialglowstudio/?q=a+poster+with+the+words+team+surrounded+by+people+%E2%9C%A8911,2026-01-26 09:00:00,"social media design graphics,social media design inspiration,social media designs,social media design ideas,social media design graphics posts,social media design post,social media design ads,social media design background,social media design template,social media design graphics marketing",https://www.pinterest.com/pin/2040762328948436/
the social media templates are designed to look like they have been created in photoshopped ✨101,https://i.pinimg.com/236x/c3/53/2d/c3532dcade4529251ce026ba12bb0d8e.jpg,Modern Canva Templates for Entrepreneurs,,"Nov 1, 2025 - Design eye-catching social media posts with minimalist art and quotes using Canva! Perfect for simple, elegant Facebook ads, social media packs, and templates. 🎨✨ Simple tips to craft 5+ stunning posts in minutes. Stand out with clean, professional layouts. Ideal for marketers and content creators aiming for sleek, impactful visuals! 📱💡",https://sites.google.com/view/socialglowstudio/?q=the+social+media+templates+are+designed+to+look+like+they+have+been+created+in+photoshopped+%E2%9C%A8101,2026-01-26 10:50:00,"social media design graphics,social media design inspiration,social media designs,social media design ideas,social media design graphics posts,social media design post,social media design ads,social media design background,social media design template,social media design graphics marketing",https://www.pinterest.com/pin/1099933909020890571/
"Sushi Design Ideas, Feed Instagram Food Design, Food Product Poster, Food Poster Ideas, Menu Design Restaurant, Dimsum Poster Design, Flyer Makanan, Food Poster Design Graphics, Ramadan Food Delivery ✨648",https://i.pinimg.com/236x/f3/50/8c/f3508c8f954ada3cd5687aeb65e234e3.jpg,Modern Canva Templates for Entrepreneurs,,"Jul 1, 2025 - 🍽️✨ Looking for a free Instagram Canva template perfect for your restaurant? This stylish and easy-to-edit design helps you create eye-catching posts and stories to showcase your menu and attract new customers.🎨 Quickly customize with your photos, logo,...",https://sites.google.com/view/socialglowstudio/?q=Sushi+Design+Ideas%2C+Feed+Instagram+Food+Design%2C+Food+Product+Poster%2C+Food+Poster+Ideas%2C+Menu+Design+Restaurant%2C+Dimsum+Poster+Design%2C+Flyer+Makanan%2C+Food+Poster+Design+Graphics%2C+Ramadan+Food+Delivery+%E2%9C%A8648,2026-01-26 12:44:00,"social media design graphics,social media design inspiration,social media designs,social media design ideas,social media design graphics posts,social media design post,social media design ads,social media design background,social media design template,social media design graphics marketing",https://www.pinterest.com/pin/17662623533702641/
the social media post is shown with different images ✨299,https://i.pinimg.com/236x/a9/7c/03/a97c0334d96fdc281cbaaf1893916842.jpg,Modern Canva Templates for Entrepreneurs,,"Click here and download 30658+ different graphic Social Media Templates. Windows, Mac, Linux ✓ Licence included with all files ✓",https://sites.google.com/view/socialglowstudio/?q=the+social+media+post+is+shown+with+different+images+%E2%9C%A8299,2026-01-26 14:19:00,"social media design graphics,social media design inspiration,social media designs,social media design ideas,social media design graphics posts,social media design post,social media design ads,social media design background,social media design template,social media design graphics marketing",https://www.pinterest.com/pin/746964288358190629/
"an advertisement for a car detailing company with blue and black graphics on the front, two men ✨674",https://i.pinimg.com/236x/ba/1c/07/ba1c078704143b43b8d12e478b5ba078.jpg,Modern Canva Templates for Entrepreneurs,,"Jul 5, 2025 - Instagram is a huge social network with over 1 million activeusers – a user base that is continuing to grow even now with no signs of slowing down. It is quick to manage thanks to its largely visual nature, and has some of the best engagement on the web.Many companies use Instagram to boost their products and services …",https://sites.google.com/view/socialglowstudio/?q=an+advertisement+for+a+car+detailing+company+with+blue+and+black+graphics+on+the+front%2C+two+men+%E2%9C%A8674,2026-01-26 15:52:00,"social media design graphics,social media design inspiration,social media designs,social media design ideas,social media design graphics posts,social media design post,social media design ads,social media design background,social media design template,social media design graphics marketing",https://www.pinterest.com/pin/12947917675159082/
"Post Design. The Flow of Solacea 🌐 #AutomateYourLife #EfficientAutomation #StreamlineYourTasks #SimplifyYourRoutine #TimeSavingAutomation.. Instagram Product Post Ideas, Instagram Campaign Post Ideas, Giveaway Aesthetic Post, Beauty Social Media Post Design, Beauty Social Media Design, Beauty Brand Social Media Post, Cosmetics Social Media, Cosmetics Social Media Post, Beauty Product Social Media Post ✨999",https://i.pinimg.com/236x/79/d0/2c/79d02cd68d9d0810770bf05d80785aec.jpg,Modern Canva Templates for Entrepreneurs,,How Make.com Revolutionizes Both Business and Daily Tasks,https://sites.google.com/view/socialglowstudio/?q=Post+Design.+The+Flow+of+Solacea+%F0%9F%8C%90+%23AutomateYourLife+%23EfficientAutomation+%23StreamlineYourTasks+%23SimplifyYourRoutine+%23TimeSavingAutomation..+Instagram+Product+Post+Ideas%2C+Instagram+Campaign+Post+Ideas%2C+Giveaway+Aesthetic+Post%2C+Beauty+Social+Media+Post+Design%2C+Beauty+Social+Media+Design%2C+Beauty+Brand+Social+Media+Post%2C+Cosmetics+Social+Media%2C+Cosmetics+Social+Media+Post%2C+Beauty+Product+Social+Media+Post+%E2%9C%A8999,2026-01-26 17:41:00,"social media design graphics,social media design inspiration,social media designs,social media design ideas,social media design graphics posts,social media design post,social media design ads,social media design background,social media design template,social media design graphics marketing",https://www.pinterest.com/pin/795307615484521777/
Social media post ✨412,https://i.pinimg.com/236x/69/c0/23/69c023bcb57be4466dd2139ebd372b75.jpg,Modern Canva Templates for Entrepreneurs,,"Advertising, Graphic Design, Illustration, Adobe Photoshop, Adobe Illustrator, Adobe Stock",https://sites.google.com/view/socialglowstudio/?q=Social+media+post+%E2%9C%A8412,2026-01-26 19:25:00,"social media design graphics,social media design inspiration,social media designs,social media design ideas,social media design graphics posts,social media design post,social media design ads,social media design background,social media design template,social media design graphics marketing",https://www.pinterest.com/pin/404479610304964765/
